{"automaticSets":[[{"commands":[{"A":199,"B":-1,"C":101,"D":0.8700000047683716,"Type":5,"index":25}],"count":1,"effect":771,"id":737,"name":"Resources last +15%","requires":[]},{"commands":[{"A":199,"B":-1,"C":101,"D":0.7699999809265137,"Type":5,"index":25}],"count":1,"effect":772,"id":738,"name":"Resources last +30%","requires":[]},{"commands":[{"A":199,"B":-1,"C":101,"D":0.7139999866485596,"Type":5,"index":25}],"count":1,"effect":773,"id":739,"name":"Resources last +40%","requires":[]},{"commands":[{"A":199,"B":-1,"C":101,"D":0.6669999957084656,"Type":5,"index":25}],"count":1,"effect":774,"id":740,"name":"Resources last +50%","requires":[]},{"commands":[{"A":199,"B":-1,"C":101,"D":0.5709999799728394,"Type":5,"index":25}],"count":1,"effect":775,"id":741,"name":"Resources last +75%","requires":[]},{"commands":[{"A":199,"B":-1,"C":101,"D":0.5,"Type":5,"index":25}],"count":1,"effect":776,"id":742,"name":"Resources last +100%","requires":[]},{"commands":[{"A":199,"B":-1,"C":101,"D":0.4440000057220459,"Type":5,"index":25}],"count":1,"effect":777,"id":743,"name":"Resources last +125%","requires":[]},{"commands":[{"A":199,"B":-1,"C":101,"D":0.4000000059604645,"Type":5,"index":25}],"count":1,"effect":778,"id":744,"name":"Resources last +150%","requires":[]},{"commands":[{"A":199,"B":-1,"C":101,"D":0.36399999260902405,"Type":5,"index":25}],"count":1,"effect":779,"id":745,"name":"Resources last +175%","requires":[]},{"commands":[{"A":199,"B":-1,"C":101,"D":0.3330000042915344,"Type":5,"index":25}],"count":1,"effect":780,"id":746,"name":"Resources last +200%","requires":[]},{"commands":[{"A":199,"B":-1,"C":101,"D":0.25,"Type":5,"index":25}],"count":1,"effect":781,"id":747,"name":"Resources last +300%","requires":[]},{"commands":[{"A":-1,"B":4,"C":13,"D":1.0199999809265137,"Type":5,"index":0}],"count":2,"effect":1265,"id":1311,"name":"Masonry Researched for Vedic Teachings","requires":[50,1309]},{"commands":[{"A":-1,"B":4,"C":13,"D":1.0199999809265137,"Type":5,"index":0}],"count":2,"effect":1265,"id":1312,"name":"Architecture Researched for Vedic Teachings","requires":[51,1309]},{"commands":[{"A":-1,"B":4,"C":13,"D":1.0199999809265137,"Type":5,"index":0}],"count":2,"effect":1265,"id":1313,"name":"Fortified Wall Researched for Vedic Teachings","requires":[194,1309]},{"commands":[{"A":-1,"B":4,"C":13,"D":1.0199999809265137,"Type":5,"index":0}],"count":2,"effect":1265,"id":1314,"name":"Chemistry Researched for Vedic Teachings","requires":[47,1309]},{"commands":[{"A":-1,"B":4,"C":13,"D":1.0199999809265137,"Type":5,"index":0}],"count":2,"effect":1265,"id":1315,"name":"Ballistics Researched for Vedic Teachings","requires":[93,1309]},{"commands":[{"A":-1,"B":4,"C":13,"D":1.0199999809265137,"Type":5,"index":0}],"count":2,"effect":1265,"id":1316,"name":"Siege Engineers Researched for Vedic Teachings","requires":[377,1309]},{"commands":[{"A":-1,"B":4,"C":13,"D":1.0199999809265137,"Type":5,"index":0}],"count":2,"effect":1265,"id":1317,"name":"Guard Tower Researched for Vedic Teachings","requires":[140,1309]},{"commands":[{"A":-1,"B":4,"C":13,"D":1.0199999809265137,"Type":5,"index":0}],"count":2,"effect":1265,"id":1318,"name":"Keep Researched for Vedic Teachings","requires":[63,1309]},{"commands":[{"A":-1,"B":4,"C":13,"D":1.0199999809265137,"Type":5,"index":0}],"count":2,"effect":1265,"id":1319,"name":"Heated Shot Researched for Vedic Teachings","requires":[380,1309]},{"commands":[{"A":-1,"B":4,"C":13,"D":1.0199999809265137,"Type":5,"index":0}],"count":2,"effect":1265,"id":1320,"name":"Arrowslits Researched for Vedic Teachings","requires":[608,1309]},{"commands":[{"A":-1,"B":4,"C":13,"D":1.0199999809265137,"Type":5,"index":0}],"count":2,"effect":1265,"id":1321,"name":"Murder Holes Researched for Vedic Teachings","requires":[322,1309]},{"commands":[{"A":-1,"B":4,"C":13,"D":1.0199999809265137,"Type":5,"index":0}],"count":2,"effect":1265,"id":1322,"name":"Treadmill Crane Researched for Vedic Teachings","requires":[54,1309]}],[{"commands":[],"count":1,"effect":-1,"id":722,"name":"Shadow TC -- Age One","requires":[]},{"commands":[{"A":621,"B":-1,"C":101,"D":1.7999999523162842,"Type":5,"index":0},{"A":617,"B":-1,"C":101,"D":1.7999999523162842,"Type":5,"index":1},{"A":484,"B":-1,"C":101,"D":1.7999999523162842,"Type":5,"index":2},{"A":597,"B":-1,"C":101,"D":1.7999999523162842,"Type":5,"index":3}],"count":2,"effect":759,"id":723,"name":"Change TC constr time1","requires":[101,722]},{"commands":[{"A":621,"B":-1,"C":101,"D":0.5555599927902222,"Type":5,"index":0},{"A":617,"B":-1,"C":101,"D":0.5555599927902222,"Type":5,"index":1},{"A":484,"B":-1,"C":101,"D":0.5555599927902222,"Type":5,"index":2},{"A":597,"B":-1,"C":101,"D":0.5555599927902222,"Type":5,"index":3}],"count":2,"effect":760,"id":724,"name":"Change TC constr time2","requires":[102,723]},{"commands":[{"A":199,"B":-1,"C":101,"D":0.8700000047683716,"Type":5,"index":25}],"count":1,"effect":771,"id":737,"name":"Resources last +15%","requires":[]},{"commands":[{"A":199,"B":-1,"C":101,"D":0.7699999809265137,"Type":5,"index":25}],"count":1,"effect":772,"id":738,"name":"Resources last +30%","requires":[]},{"commands":[{"A":199,"B":-1,"C":101,"D":0.7139999866485596,"Type":5,"index":25}],"count":1,"effect":773,"id":739,"name":"Resources last +40%","requires":[]},{"commands":[{"A":199,"B":-1,"C":101,"D":0.6669999957084656,"Type":5,"index":25}],"count":1,"effect":774,"id":740,"name":"Resources last +50%","requires":[]},{"commands":[{"A":199,"B":-1,"C":101,"D":0.5709999799728394,"Type":5,"index":25}],"count":1,"effect":775,"id":741,"name":"Resources last +75%","requires":[]},{"commands":[{"A":199,"B":-1,"C":101,"D":0.5,"Type":5,"index":25}],"count":1,"effect":776,"id":742,"name":"Resources last +100%","requires":[]},{"commands":[{"A":199,"B":-1,"C":101,"D":0.4440000057220459,"Type":5,"index":25}],"count":1,"effect":777,"id":743,"name":"Resources last +125%","requires":[]},{"commands":[{"A":199,"B":-1,"C":101,"D":0.4000000059604645,"Type":5,"index":25}],"count":1,"effect":778,"id":744,"name":"Resources last +150%","requires":[]},{"commands":[{"A":199,"B":-1,"C":101,"D":0.36399999260902405,"Type":5,"index":25}],"count":1,"effect":779,"id":745,"name":"Resources last +175%","requires":[]},{"commands":[{"A":199,"B":-1,"C":101,"D":0.3330000042915344,"Type":5,"index":25}],"count":1,"effect":780,"id":746,"name":"Resources last +200%","requires":[]},{"commands":[{"A":199,"B":-1,"C":101,"D":0.25,"Type":5,"index":25}],"count":1,"effect":781,"id":747,"name":"Resources last +300%","requires":[]},{"commands":[{"A":-1,"B":4,"C":13,"D":1.0199999809265137,"Type":5,"index":0}],"count":2,"effect":1265,"id":1311,"name":"Masonry Researched for Vedic Teachings","requires":[50,1309]},{"commands":[{"A":-1,"B":4,"C":13,"D":1.0199999809265137,"Type":5,"index":0}],"count":2,"effect":1265,"id":1312,"name":"Architecture Researched for Vedic Teachings","requires":[51,1309]},{"commands":[{"A":-1,"B":4,"C":13,"D":1.0199999809265137,"Type":5,"index":0}],"count":2,"effect":1265,"id":1313,"name":"Fortified Wall Researched for Vedic Teachings","requires":[194,1309]},{"commands":[{"A":-1,"B":4,"C":13,"D":1.0199999809265137,"Type":5,"index":0}],"count":2,"effect":1265,"id":1314,"name":"Chemistry Researched for Vedic Teachings","requires":[47,1309]},{"commands":[{"A":-1,"B":4,"C":13,"D":1.0199999809265137,"Type":5,"index":0}],"count":2,"effect":1265,"id":1315,"name":"Ballistics Researched for Vedic Teachings","requires":[93,1309]},{"commands":[{"A":-1,"B":4,"C":13,"D":1.0199999809265137,"Type":5,"index":0}],"count":2,"effect":1265,"id":1316,"name":"Siege Engineers Researched for Vedic Teachings","requires":[377,1309]},{"commands":[{"A":-1,"B":4,"C":13,"D":1.0199999809265137,"Type":5,"index":0}],"count":2,"effect":1265,"id":1317,"name":"Guard Tower Researched for Vedic Teachings","requires":[140,1309]},{"commands":[{"A":-1,"B":4,"C":13,"D":1.0199999809265137,"Type":5,"index":0}],"count":2,"effect":1265,"id":1318,"name":"Keep Researched for Vedic Teachings","requires":[63,1309]},{"commands":[{"A":-1,"B":4,"C":13,"D":1.0199999809265137,"Type":5,"index":0}],"count":2,"effect":1265,"id":1319,"name":"Heated Shot Researched for Vedic Teachings","requires":[380,1309]},{"commands":[{"A":-1,"B":4,"C":13,"D":1.0199999809265137,"Type":5,"index":0}],"count":2,"effect":1265,"id":1320,"name":"Arrowslits Researched for Vedic Teachings","requires":[608,1309]},{"commands":[{"A":-1,"B":4,"C":13,"D":1.0199999809265137,"Type":5,"index":0}],"count":2,"effect":1265,"id":1321,"name":"Murder Holes Researched for Vedic Teachings","requires":[322,1309]},{"commands":[{"A":-1,"B":4,"C":13,"D":1.0199999809265137,"Type":5,"index":0}],"count":2,"effect":1265,"id":1322,"name":"Treadmill Crane Researched for Vedic Teachings","requires":[54,1309]}],[{"commands":[],"count":0,"effect":104,"id":104,"name":"Dark Age","requires":[]},{"commands":[{"A":45,"B":-1,"C":13,"D":1.0499999523162842,"Type":5,"index":4},{"A":133,"B":-1,"C":13,"D":1.100000023841858,"Type":5,"index":5},{"A":47,"B":-1,"C":13,"D":1.149999976158142,"Type":5,"index":6},{"A":51,"B":-1,"C":13,"D":1.2000000476837158,"Type":5,"index":7},{"A":1189,"B":-1,"C":13,"D":1.2000000476837158,"Type":5,"index":8}],"count":1,"effect":421,"id":409,"name":"C-Bonus, TC and Dock work rate","requires":[104]},{"commands":[{"A":199,"B":-1,"C":101,"D":0.8700000047683716,"Type":5,"index":25}],"count":1,"effect":771,"id":737,"name":"Resources last +15%","requires":[]},{"commands":[{"A":199,"B":-1,"C":101,"D":0.7699999809265137,"Type":5,"index":25}],"count":1,"effect":772,"id":738,"name":"Resources last +30%","requires":[]},{"commands":[{"A":199,"B":-1,"C":101,"D":0.7139999866485596,"Type":5,"index":25}],"count":1,"effect":773,"id":739,"name":"Resources last +40%","requires":[]},{"commands":[{"A":199,"B":-1,"C":101,"D":0.6669999957084656,"Type":5,"index":25}],"count":1,"effect":774,"id":740,"name":"Resources last +50%","requires":[]},{"commands":[{"A":199,"B":-1,"C":101,"D":0.5709999799728394,"Type":5,"index":25}],"count":1,"effect":775